url,title,author,location,date_time,article_text
https://www.milenio.com/politica/paseo-reforma-angelindependencia-diana-cazadora-glorieta-colon-cdmx,De 'Paseo de la Emperatriz' a los anti monumentos: así ha cambiado avenida Reforma,Olinka Valdez Morales,Ciudad de México,11-08-2019 11:58:19,"Paseo de la Emperatriz, Paseo Degollado, Paseo de la Reforma y hasta Paseo de las Víctimas, la avenida más emblemática de la Ciudad de México pasó de ser una arteria exclusiva del emperador, al espacio que familiares de miles de víctimas en el país reclaman como suyo para exigir justicia.Más de 150 años antes de los anti monumentos, que surgieron en el sexenio del ex presidente Enrique Peña Nieto, la avenida fue ideada para que Maximiliano de Habsburgo pudiera trasladarse rápidamente del Castillo de Chapultepec a su despacho en Palacio Nacional.La ruta incluía una sola glorieta, donde hoy se ubica La Palma, y era utilizada de manera exclusiva por Maximiliano y Carlota.  Al término del segundo imperio, el presidente Benito Juárez abrió la avenida, el 17 de febrero de 1872, y  la llamó Paseo Degollado.De acuerdo con el Plan de Mejoras de 1866, que se conserva en el Archivo Histórico de la Ciudad de México, la propuesta era arreglar terrenos, plantar árboles en la avenida  y trazar caminos para instalar edificios de utilidad pública. El documento, citado por la investigadora Guadalupe Lozada León, incluía embellecer la avenida con cuatro hileras de árboles, bancos de hierro, fuentes e irrigadores con una máquina hidráulica general y tenía prevista la instalación de una glorieta con una fuente de Cristóbal Colón.En 1872, la avenida recibió su nombre definitivo durante el gobierno de Sebastián Lerdo de Tejada: Paseo de la Reforma, para honrar a los defensores de la República.En el gobierno de Porfirio Díaz, Paseo de la Reforma se  convertiría en sitio de reunión más importante: La palma, en la glorieta que hoy lleva su nombre, fue el primer monumento que se colocó; el investigador Joaquín E. Espinosa Aguirre asegura que la enorme palmera que hoy adorna la avenida fue plantada en 1920.El ex presidente Felipe Calderón Hinojosa proyectó la construcción de La Estela de Luz parte de los festejos del centenario de la Revolución y del Bicentenario de la Independencia. La obra se inauguró a destiempo, el 7 de enero de 2012, en medio de señalamientos de la Auditoría Superior de la Federación por irregularidades en el ejercicio de su presupuesto.  Ya en la administración del Peña Nieto, el Movimiento por la Paz, la Justicia y la Dignidad, encabezado por Javier Sicilia, solicitó a la Presidencia autorización para ""resignificar"" el monumento y dedicarlo a los miles de desaparecidos. No hubo respuesta y en marzo de 2014, integrantes del movimiento instalaron 42 placas para honrar a las víctimas de la violencia; algunas incluyen los nombres de personas desaparecidas. El 27 de abril de 2015, padres de los 43 estudiantes de la Escuela Normal rural de Ayotzinapa instalaron un anti monumento en el cruce de Reforma y Bucareli para exigir al gobierno la aparición con vida de los jóvenes, quienes fueron secuestrados por policías municipales de Iguala y Cocula, el 26 de septiembre de 2014. El 5 de junio de 2017, padres de los 49 niños que murieron en el incendio de la guardería ABC en Sonora instalaron un memorial a ocho años de la tragedia. El monumento está en Paseo de la Reforma, esquina Toledo, frente a las oficinas del Instituto Mexicano del Seguro Social (IMSS). El 5 de enero de 2018, los padres de David Ramírez y Miguel Ángel Rivera erigieron un monumento para exigir a las autoridades la localización de los jóvenes, quienes fueron secuestrados el 5 de enero de 2012 cuando viajaban a Zihuatanejo para celebrar el cumpleaños 20  de uno de ellos. La familia pagó el rescate que exigían, pero los jóvenes no volvieron. Y las autoridades no han dado con los responsables. El memorial está en Paseo de la Reforma y avenida Juárez. En febrero de 2018, frente a la Bolsa Mexicana de Valores, en Reforma  casi esquina con la Glorieta de la Palma se ubica el monumento para recordar a los 65 mineros que permanecen enterrados en Pasta de Conchos desde hace 13 años. ​"
https://www.milenio.com/politica/morena-denuncia-embestida-enemigos-mexico-4t,Morena en San Lázaro denuncia embestida de “enemigos de México” contra la 4T,Fernando Damián,Ciudad de México,21-03-2021 16:38:56,"El líder parlamentario de Morena en la Cámara de Diputados, Ignacio Mier, denunció una embestida de los “enemigos de México” contra la llamada cuarta transformación.En el marco de la conmemoración del natalicio de Benito Juárez, el legislador sostuvo que México está obligado a honrar los ideales de defensa de la soberanía y la transformación social humanista, contra el pensamiento conservador que se aferra al poder y la corrupción.Sin mencionar nombres, Mier definió a los adversarios del país y de la cuarta transformación.Dijo que los enemigos actuales de México se encuentran en muchos ámbitos: ""algunos que al amparo del poder ejercen actos de corrupción, defraudan a la Hacienda Pública, manejan recursos de procedencia ilícita y maniobran para impedir que se conozca el origen de los recursos y su fortuna”, indicó.Igualmente señaló a quienes ejercen sus facultades para proteger intereses que se han beneficiado con leyes a modo, amparados en la ilegalidad, para provocar saqueo a la nación y afectar nuestra soberanía energética.En ese contexto, Mier subrayó que el grupo parlamentario de Morena acompañará desde la Cámara de Diputados el proyecto de la cuarta transformación contra todas las adversidades. ​JLMR"
https://www.milenio.com/politica/cifras-21-marzo-mexico-suma-198-mil-036-muertes-coronavirus,México suma 198 mil 036 muertes por covid-19,Milenio Digital,Ciudad de México,21-03-2021 19:11:49,"México acumula 198 mil 036 muertes por coronavirus SARS-CoV-2 y dos millones 390 mil 095 casos estimados, de acuerdo al informe de la Secretaría de la Salud dado a conocer por Ricardo Cortés Alcalá, director de Promoción de la Salud.Asimismo, el funcionario indicó que hay 35 mil 515 casos activos estimados y un millón 736 mil 159 personas se han recuperado de la enfermedad.De 31 mil 047 camas totales, hay 24 mil 704 disponibles y 6 mil 343 están ocupadas. Sólo cuatro estados tienen entre el 30 y 49 por ciento de uso y 28 entidades tienen menos del 30 por ciento.De 10 mil 486 camas totales, hay 7 mil 932 disponibles y 2 mil 554 están ocupadas. Hay siete estados con el 30 y 49 por ciento de uso y 25 entidades tienen menos del 30 por ciento.FS"
https://www.milenio.com/politica/reportan-12-mil-esavis-vacuna-covi-mexico,Ssa reporta más de 12 mil reacciones a vacuna anticovid; 97 han sido graves,Milenio Digital,Ciudad de México,21-03-2021 19:44:31,"En México se han registrado 12 mil 308 Eventos Supuestamente Atribuibles a la Vacunación e Inmunización (ESAVI) durante la campaña nacional de inoculación contra coronavirus, informó Ricardo Cortés Alcalá, director de Promoción de la Salud.Durante la conferencia vespertina, el funcionario federal señaló que sólo 0.2 por ciento del total de vacunas aplicadas en el país ha generado un ESAVI. En total, se han aplicado 5.6 millones de dosis.Además, dijo que sólo 97 casos de los 12 mil 308 ESAVI  han sido graves, de los cuales 17 pacientes continúan hospitalizados.Del total de ESAVI registrados, 11 mil 698 fueron tras la aplicación de la vacuna de Pfizer-BioNTech, 419 de AstraZeneca, 98 de Sinovac y 93 de Sputnik V.De acuerdo con lo presentado, Aguascalientes, Campeche, Coahuila, Durango, Estado de México, Guanajuato, Guerrero, Michoacán, San Luis Potosí y Yucatán tienen una persona hospitalizada por ESAVI; mientras que Hidalgo, Oaxaca y la Ciudad de México tienen dos.RLO"
https://www.milenio.com/politica/2-de-octubre-imagenes-del-movimiento-del-68,"Entre protestas, armas y detenciones: imágenes del movimiento del 68",Milenio Digital,Ciudad de México,02-10-2019 06:25:31,"En 1968, México vivió uno de los capítulos más oscuros de su historia: la matanza de estudiantes en la Plaza de las Tres Culturas, en Tlatelolco.El movimiento estudiantil, que integraron alumnos de la UNAM, IPN y Universidad de Chapingo, demandó la democratización de la educación, la no represión y los derechos civiles. El 22 de julio de ese año, empezó el movimiento estudiantil, después de una pelea entre estudiantes de las vocacionales 2 y 5, del IPN, contra los de la preparatoria Isaac Ochoterena, incorporada a la UNAM, en donde intervino la policía.La actuación de los uniformados ocasionó el descontento entre los alumnos de ambas instituciones, quienes a partir de ese momento alzaron la voz contra la represión del gobierno.Posteriormente los estudiantes formaron el Consejo Nacional de Huelga, que se encargó de coordinar las protestas.Para el 4 de agosto, el consejo publicó su pliego petitorio, el cual ""condensaba los sueños de libertad de toda una generación"", de acuerdo con la ONU. Poco a poco fueron creciendo las movilizaciones en contra de la represión, hasta llegar a la del 13 de agosto, la cual terminó en el Zócalo de la Ciudad de México.Se calcula que más de 150 mil personas asistieron a esa manifestación.A la par del aumento de las protestas, a las que se sumaban maestros, campesinos y la sociedad en general, la represión de los uniformados creció, por lo que fue común la detención e intimidación de los manifestantes.Tras tres meses de intensas protestas, el 2 de octubre miles de estudiantes se reunieron en la Plaza de las Tres Culturas, ubicada en la unidad habitacional Tlatelolco.De acuerdo con testimonios de quienes se encontraban en la plaza , la balacera comenzó a las 18:10 horas, momentos después de que un helicóptero que sobrevolaba la zona lanzara luces de bengala.El Batallón Olimpia disparó contra los asistentes al mitin convocado por el Consejo Nacional de Huelga.Además de los muertos, hubo varios estudiantes detenidos tras el mitin en Tlatelolco. Los detenidos acusaron que sufrieron torturas y vejaciones de parte de las autoridades.Fue en el año de 1971, que el entonces presidente, Luis Echeverría, dio amnistía a varios presos políticos.El movimiento estudiantil de 1968 oficialmente concluyó el 4 de diciembre de 1968, cuando el Consejo Nacional de Huelga, integrado por estudiantes de la UNAM, el IPN y la Universidad de Chapingo acordaron firmar el decreto que ponía fina al conflicto. Sin embargo, nueve días después hubo un último intento de hacer una manifestación de la Torre de Rectoría hacia el Casco de Santo Tomás.Pero fue en el monumento a Álvaro Obregón, donde el Ejército y los granaderos lanzaron gas lacrimógeno contra los estudiantes, quienes huyeron por temor a que ocurriera una nueva balacera como la del 2 de octubre.AA"
https://www.milenio.com/politica/vacuna-adultos-mayores-aplicado-102-mil-618-segundas-dosis,"En México, 102 mil 618 adultos mayores ya tienen ambas dosis de vacuna anticovid",Milenio Digital,Ciudad de México,21-03-2021 19:45:48,"La vacunación contra coronavirus en México tiene un avance del 69 por ciento, entre el personal de salud, personal educativo de Campeche y adultos mayores de 60 años en adelante de todo el país.De 4 millones 026 mil 943 adultos mayores que han recibido la primera dosis del biológico contra coronavirus SARS-CoV-2, a 102 mil 618 ya se les aplicó la segunda dosis, lo que significa un avance del 3 por ciento en este sector.Actualmente en la Ciudad de México se está aplicando la segunda dosis anticovid en Tláhuac, Xochimilco e Iztacalco de acuerdo al siguiente calendario:Los adultos mayores que acudan a recibir la segunda dosis deben:FS"
https://www.milenio.com/politica/semana-santa-ssa-pide-relajar-medidas-covid-vacaciones,Ssa pide no relajar medidas en Semana Santa para evitar tercera ola de covid-19,Milenio Digital,Ciudad de México,21-03-2021 19:48:00,"Ricardo Cortés Alcalá, director general de Promoción de la Salud, exhortó a la población a no relajar las medidas sanitarias contra el covid-19 durante Semana Santa y así evitar una tercera ola de contagios.Durante el informe diario de coronavirus en México, Cortés Alcalá  recordó que en próximos días comenzarán las vacaciones de Semana Santa, por lo que miles de estudiantes suspenderán actividades escolares. Durante los meses de diciembre y enero se incrementaron los contagios de covid-19, por ejemplo, en la Ciudad de México la capacidad hospitalaria estuvo cerca del 90 por ciento y el semáforo epidemiológico en rojo obligó al cierre de actividades no esenciales.  Una de las medidas tomadas en la segunda ola fue traer médicos del IMSS que radican en otros estados para atender pacientes con covid en la Ciudad de México, estrategia conocida como ""Operación Chapultepec"". JLMR"
https://www.milenio.com/politica/comunidad/bosque-de-chapultepec-su-historia-en-imagenes,Bosque de Chapultepec: de la fundación de Tenochtitlán al mejor parque del mundo,Olinka Valdez Morales,Ciudad de México,24-08-2019 22:33:32,"El Bosque de Chapultepec no es sólo el mejor parque urbano en el mundo, de acuerdo con la organización World Urban Parks, sino el sitio fundacional de lo que hoy es México porque marca la última etapa de la peregrinación de los mexicas antes que los tenochas tomaran posesión de las lagunas y colocaran la primera piedra de su sede definitiva, Tenochtitlán, en el peñón donde un águila parada en un nopal devoraba a una serpiente. ​El bosque y sus cinco antiguos lagos fueron el hogar de distintos personajes de estirpe real, desde Nezahualcóyotl a Moctezuma, de quien se dice que plantó el bosque de ahuehuetes y a quien los historiadores atribuyen la canalización de las albercas y la construcción del primer acueducto que llevó agua a la Ciudad de México hasta la llegada de los españoles.En Chapultepec, su leyenda y su historia, Rubén M. Campos reconstruye la historia del mítico bosque, un espacio en el que todos cabemos. Poco después de la caída de México-Tenochtitlan, en 1521, comienza la invasión del bosque; Cortés se apropia de Chapultepec como parte de la Villa de Coyoacán, primer ayuntamiento del Altiplano. En 1530 se otorga Chapultepec a la Ciudad de México como lugar de recreo para sus habitantes.Felipe II ordenó que el Bosque de Chapultepec fuera separado de las posesiones que Carlos V concedió a Hernán Cortés y, luego, entregado a la Ciudad de México a perpetuidad, para que nadie impidiera el uso de sus fuentes y albercas. Hoy, las fuentes ya no están disponibles para usarse y los baños de Moctezuma pueden apreciarse como parte de los atractivos turísticos que ofrece el bosque en sus casi 700 hectáreas.Aquí te invitamos a conocerlas.Las albercas abastecieron de agua a la Ciudad de México durante cuatro siglos, pero hoy están clausuradas y rodeadas por rejas, conservadas sólo como un recuerdo. Castillo de ChapultepecEl virrey Don Bernardo de Gálvez levantó el Alcázar de Chapultepec. En 1785 inició la construcción de un palacio que tenía forma de fortaleza, pero murió sin concluirlo. Durante la Independencia, el Castillo de Chapultepec estuvo abandonado hasta que en 1843 se convirtió en la sede del Colegio Militar. En 1847 el Castillo de Chapultepec fue escenario de la defensa de los cadetes del colegio frente a la intervención norteamericana. De 1864 a 1867 se convirtió en el Palacio Imperial que habitaron el emperador Maximiliano y la emperatriz Carlota.Con el presidente Porfirio Díaz, el castillo fue nuevamente la residencia del Colegio Militar mientras que el Alcázar fue utilizado como residencia presidencial hasta que Lázaro Cárdenas cedió el edificio al pueblo de México en 1939 y se convirtió en el Museo Nacional de Historia.El castillo está rodeado por más de 300 ahuehuetes, “viejo de agua”, y el más corpulento mide 15 metros de circunferencia. Altar a la Patria o el Obelisco a los Niños HéroesEl monumento en forma de columna fue donado por la Asociación del Colegio Militar y está conformado por tres estructuras que disminuyen su tamaño a medida que ascienden, de acuerdo con información de la Secretaría del Medio Ambiente (Sedema). En la primera estructura hay una palma dorada coronada con un medallón que tiene escritos los nombres de los Niños Héroes; la segunda tiene inscrita la fecha conmemorativa del 13 de septiembre de 1847 y está dedicado a los cadetes que murieron durante la intervención. Lago de ChapultepecEl lago de Chapultepec es una formación artificial que data de la época de Porfirio Díaz y tiene un fondo de concreto. El lago mayor tiene una extensión de casi 53 mil metros cuadrados y el lago menor de 14 mil 400; hay patos y en el lugar se puede practicar remo o rentar una lancha y disfrutar del paseo. Feria de ChapultepecUno de los primeros parques de atracciones en México fueron los juegos mecánicos de Chapultepec, hoy La Feria, un proyecto del gobierno del Distrito Federal e inaugurado por el entonces presidente Adolfo López Mateos el 24 de octubre de 1964. ZoológicoDe acuerdo con la Sedema, el zoológico Alfonso L. Herrera funciona desde 1927. Sus instalaciones fueron remodeladas a principio de la década de los 90 y alberga a más de mil 800 animales de 252 especies en 17 hectáreas. OVM​"
https://www.milenio.com/politica/embovedar-rio-remedios-mejorara-funcionamiento-conagua,Embovedar Río de los Remedios mejorará su funcionamiento hidráulico: Conagua,Graciela Olvera,Ciudad de México,21-03-2021 16:53:34,"La Comisión Nacional del Agua (Conagua) a través del Organismo de Cuenca Aguas del Valle de México (OCAVM), anunció los trabajos de embovedamiento del cauce del Río de los Remedios, con el objetivo de incrementar la seguridad y las condiciones de la salud de los pobladores que viven en los alrededores de la zona.El cauce del Río de los Remedios atraviesa por las alcaldías de Gustavo A. Madero, Azcapotzalco, de la Ciudad de México y los municipios de Naucalpan de Juárez, Tlalnepantla de Baz, Ecatepec de Morelos y Nezahualcóyotl, del Estado de México, uno de los ríos que en caso de desbordarse afectaría a miles de ciudadanos en estas entidades.El embovedamiento permitirá disminuir el riesgo de inundaciones y la emisión de gases y olores por descomposición de materia orgánica. Asimismo, contribuirá a disminuir la cantidad de desechos que son arrojados en las aguas del río, beneficiando a la salud de los habitantes que viven en las riveras del Río de los Remedios.En un comunicado, la Conagua detalló que trabajos son parte de la colaboración que realiza el OCAVM, en el proyecto para la construcción de la autopista Río de los Remedios, misma que agilizará el tránsito urbano de cuatro municipios del Estado de México y dos alcaldías de la capital del país.FS"
https://www.milenio.com/politica/ocurrencia-propuesta-sobre-impuesto-a-grandes-fortunas-diputada,"""Ocurrencia"", propuesta de Ramírez Cuéllar sobre impuesto a grandes fortunas: diputada",Fernando Damián,Ciudad de México,21-03-2021 18:46:38,"La presidenta de la Comisión de Hacienda de la Cámara de Diputados, Patricia Terrazas, calificó como una “ocurrencia” sin asidero legal ni técnico la propuesta del legislador morenista Alfonso Ramírez Cuéllar para cobrar un impuesto de única vez a 160 mil “grandes fortunas” en México.Terrazas remarcó que no existe una iniciativa en la materia en la comisión a su cargo y tampoco estudios o cifras para sustentar la proposición de gravar a los multimillonarios en México y destinar esos recursos a mitigar la emergencia sanitaria y económica.Consideró que se trata estrictamente de un tema mediático, pues el diputado de Morena habla de cifras, pero no explica de dónde las obtuvo, y para llegar a los números se tendría que hacer un estudio muy responsable.En entrevista con MILENIO, Ramírez Cuéllar aseguró que su propuesta para cobrar un gravamen a las grandes fortunas y recaudar hasta 100 mil millones de pesos formará parte de las discusiones del recién creado Grupo de Trabajo para la Transición Hacendaria de la Cámara de Diputados, con el fin de consensuar un nuevo proyecto de reforma fiscal.No obstante, Terrazas instó a Ramírez Cuéllar a ser institucional y cuidar mucho lo que dice, pues el planteamiento del impuesto a las grandes fortunas ha generado la preocupación, la incertidumbre y la desconfianza de amplios sectores en el país.Llamó por ello a la mayoría parlamentaria de Morena a evitar la contaminación de un debate estrictamente técnico con elementos ideológicos, pues ello llevaría al grupo de trabajo al fracaso.JLMR"
https://www.milenio.com/politica/conferencia-coronavirus-mexico-temas-covid-19-21-marzo,Temas de la conferencia sobre el coronavirus en México del 21 de marzo,Milenio Digital,Ciudad de México,21-03-2021 18:56:40,"México suma 198 mil 036  muertes por covid-19 y 2 millones 390 mil 095 casos estimados, de acuerdo al informe de la Secretaría de Salud dado a conocer por Ricardo Cortés Alcalá , director general de Promoción de la Salud.Semáforo nacional de coronavirusEn el actual semáforo epidemiológico por coronavirus SARS-CoV-2, hay 0 estados en color rojo, 8 en naranja, 21 en amarillo y 3 están en verde.​De 31 mil 047 camas totales, hay 24 mil 704 disponibles y 6 mil 343 están ocupadas. Morelos, Puebla, Estado de México y Ciudad de México tienen entre el 30% y 49% de ocupación.De 10 mil 486 camas con ventilador totales, hay 7 mil 932 disponibles y 2 mil 554 están ocupadas. Sólo 7 entidades tienen entre el 30% y el 49%, así como 25 estados con menos del 30%.Hasta el momento, 26 mil 943 personas adultas mayores ya han recibido su primera dosis, mientras que 102 mil 618 ya cuenta con su esquema de vacunación completo. Por otro lado, 851 mil 117 individuos que trabajan en el sector salud tienen su primera vacuna y sólo 596 mil 721 han recibido el refuerzo.  Alcalá aseguró que se aplican más primeras dosis de vacunas covid-19.Derivado de la próxima llegada de las vacaciones de Semana Santa, el director general de Promoción de la Salud exhortó a la población a continuar con las medidas sanitarias para evitar un repunte de contagios de covid-19Respecto a la vacuna contra el coronavirus que México desea desarrollar, se comentó que la Universidad del estado de Querétaro está teniendo buenos resultados para poder avanzar en los ensayos clínicos.Informaron que es necesario que este tipo de investigaciones tenga un financiamiento, y específicamente este proceso está siendo subsidiado por Amexcid.También aseguró que la Secretaría de Salud no dará apoyo económico para el desarrollo de la vacuna de la Universidad de Querétaro, ya que Conacyt y otro otros organismos son los que financian proyectos de este tipo. El funcionario invitó a la población de adultos mayores a ir bien descansados a aplicarse la vacuna, ya que esto les da un sistema inmune mucho más fuerte; así como también mencionó que es necesario ir bien hidratados y desayunados o comidos, y haber tomado los medicamentos correspondientes de cada persona. Alcalá dijo que se han registrado 12 mil 308 Eventos Supuestamente Atribuibles a la Vacunación e Inmunización (ESAVIs), lo cual sólo representa el 0.2 por ciento del totcal de vacunas aplicadas en México y que han sido contabilizadas con efectos adversos.Durante la conferencia de prensa se dijo que las vacunas que dará Estados Unidos a México son un préstamo porque primero deben llegar los inoculantes al país y posteriormente hacer el pago del mismo.Se aseguró que también Canadá forma parte de este acuerdo; sin embargo, no se ahondó más en el tema porque se sostuvo que Marcelo Ebrard es la persona encargada de informar sobre este tipo de cuestiones. KACY"
https://www.milenio.com/politica/coronavirus-mexico-registra-cifras-bajas-covid-2020,México registra las cifras de muertes y casos de coronavirus más bajas desde 2020,Milenio Digital,Ciudad de México,16-03-2021 21:24:32,"Este 16 de marzo se registró una de las cifras de casos y muertes por coronavirus SARS-CoV-2 más bajas desde 2020, de acuerdo al informe técnico de la Secretaría de Salud.En cuanto a los decesos por la enfermedad, este día se contabilizaron 195 mil 119, que respecto a las registradas el día de ayer son 175, cifra que no se observaba desde el 17 de noviembre de 2020, cuando hubo un aumento de 165 defunciones.Respecto a los 2 millones 169 mil 007 casos acumulados por covid-19, hoy se registraron mil 278 nuevos, la cifra más baja desde el 5 de mayo de 2020, cuando se reportaron mil 120 nuevos contagios.La Secretaría de Salud ha reconocido un descenso en la transmisión del virus en todo el país, lo cual se ve reflejado en la ocupación hospitalaria y el semáforo epidemiológico, donde ya no hay ningún estado en color rojo.Actualmente la ocupación de camas generales está en 24 por ciento, seis estados tienen entre el 30 y 40 por ciento de uso y 26 tienen menos del 30 por ciento de ocupación.Mientras que en las camas con ventilador, ocho estados tienen entre el 30 y 49 por ciento de uso y 24 tienen menos del 30 por ciento.Semáforo epidemiológicoEn el actual semáforo epidemiológico por coronavirus hay ocho estados en color naranja, 21 en amarillo y tres en verde.FS​"
