url,title,author,location,date_time,article_text
https://www.milenio.com/politica/comunidad/angel-independencia-restauracion-caida-sismo-57,Así restauraron el Ángel de la Independencia tras su caída en el sismo del 57,Milenio Digital,Ciudad de México,16-11-2019 22:05:32,"Tras el terremoto que sacudió la Ciudad de México el 28 de julio de 1957, el Ángel de la Independencia cayó y quedó completamente destrozado. Sin embargo, se inició su restauración, que consistió en reforzar el interior de la columna con placas de metal y se reemplazó la escalera de piedra interna por una metálica.Además, se construyó una nueva Victoria Alada que fue colocada en la cima de la estructura. Luego de más de un año de obras, la reinauguración se llevó a cabo el 16 de septiembre de 1958.Uno de los restauradores fue Moisés Navarro, bajo el mando de Ramón Bonfil, quien se dedicaba a inspeccionar los trabajos de reconstrucción y que unió una por una las piezas de este monumento.El proyecto de construcción de la Columna de la Independencia de México, su nombre oficial, estuvo a cargo del arquitecto Antonio Rivas Mercado, no obstante, el escultor italiano Enrique Alciati fue el responsable de las esculturas y los bajorrelieves, mientras que el ingeniero Roberto Gayol de la obra civil. Se ubica en Reforma, una avenida que originalmente se llamó Paseo de la Emperatriz o Paseo del Emperador, pues su trazo fue encargado por Maximiliano I, durante el segundo imperio. [Foto: Omar Franco][Foto: Omar Franco]La primera piedra de esta escultura se colocó el 2 de enero de 1902, y al interior se depositó un cofre dorado con el acta de independencia y monedas de cuño corriente de la época. Por su belleza, el Ángel de la Independencia es sede para festejos patrios, triunfos deportivos o como escenario para fotografías a propósito de celebraciones familiares como bodas o XV años. [Foto: Omar Franco]icc"
https://www.milenio.com/politica/como-se-construyo-el-palacio-de-bellas-artes,"Bellas Artes, un palacio de 85 años",Milenio Digital,Ciudad de México,20-10-2019 15:25:51,"Uno de los proyectos más ambiciosos de la arquitectura mexicana, el Palacio de Bellas Artes, celebra 85 años de existencia y se ha convertido en uno de los recintos artísticos más importantes, y no sólo alberga al Teatro Nacional de México, también al Museo Nacional de Arquitectura. El edificio es la sede principal de la Orquesta Sinfónica Nacional, La Compañía Nacional de Danza, la Compañía Nacional de Ópera y el Ballet Folklórico de México. Además, el Palacio de Bellas Artes alberga obras de los principales muralistas y pintores mexicanos del siglo XX: El hombre controlador del universo, de Diego Rivera; Chatarsis, de José Clemente Orozco; La nueva democracia, Víctimas de la guerra; Víctimas del fascismo y Tormento y apoteosis de Cuauhtémoc, de David Alfaro Siqueiros. Nacimiento de la nacionalidad y México de hoy, de Rufino Tamayo, y La humanidad liberándose, de Jorge González Camarena. La edificación del Palacio de Bellas Artes fue un proyecto emprendido por el presidente Porfirio Díaz, que se decantó por obras monumentales, entre ellas el Palacio Postal, el Hospital General, la Columna de la Independencia  y aunque quedó inconcluso, el Palacio del Poder Legislativo, en donde hoy podemos apreciar el monumento a la Revolución. El proyecto del Nuevo Teatro Nacional recayó inicialmente en el arquitecto italiano Adamo Boari y del ingeniero Gonzalo Garita y el objetivo era construir un teatro moderno que no se apartara de las proporciones clásicas y que, al mismo tiempo, aprovechara los mayores adelantos tecnológicos de la época. Para ampliar el proyecto del nuevo teatro se tomó la decisión de demoler el antiguo teatro, con lo que se prolongó hasta la calle 5 de Mayo, desde Bolívar hasta Santa Isabel (Eje Central).La construcción inició en 1904 y estaba planeada para cuatro años, pero en realidad fueron 30. Porfirio Díaz colocó la primera piedra el 12 de abril de 1905. La plataforma con rampas, escalinatas y explanadas ocupa una superficie de 7 mil 500 metros cuadrados; el espesor es de 2.40 metros de los que 1.38 son de concreto y el resto de tezontle.La estructura de acero fue concluida en 1906 y posteriormente recubierta por concreto; los muros exteriores fueron recubiertos por el mármol más blanco del país que también fue utilizado para el basamento del edificio. El mármol utilizado para los elementos ornamentales y las columnas fue traído de Carrara, Italia. Debido al inicio de la Revolución Mexicana, la construcción del Nuevo Teatro Nacional se retrasó hasta que quedó completamente detenida en 1916 con la salida del país de Adamo Boari. Entre 1917 y 1929 hubo dos intentos de retomar la construcción del teatro, pero fue hasta el gobierno de Álvaro Obregón que en 1921 pudo retormarse, por fin, el proyecto y se estableció un comité de suscripción pública para fondear su terminación. El edificio era utilizado ya para eventos importantes y para 1928 pudieron utilizarse el exterior del teatro, el vestíbulo y las salas de espectáculos, aunque hubo que improvisar butacas. En 1930, el presidente Pascual Ortiz Rubio emitió el acuerdo de terminación del Teatro Nacional. Entonces, casi 30 años después, cambiaron el nombre al recinto que dejó de ser el Nuevo Teatro Nacional para convertirse en el Palacio de Bellas Artes que finalmente abrió sus puertas el 29 de septiembre de 1934. En 1982, el estacionamiento se transformó en un jardín, doce años más tarde, se construyó un estacionamiento subterráneo, sobre el cual se levantó la plaza que conocemos actualmente. ​Con información de Un Paseo virtual del Palacio de Bellas Artes​OVM"
https://www.milenio.com/politica/comunidad/merced-aniversario-62-anos-mercado-cdmx,"La Merced, 62 años de ser el gran mercado de la CdMx",Milenio Digital,Ciudad de México,21-09-2019 23:01:24,"El 22 de septiembre el mercado de La Merced cumplió 62 años de ser el principal centro de venta minorista de la Ciudad de México, por lo que te compartimos las mejores imágenes de la Fototeca MILENIO sobre cómo era, luego de que esta Nochebuena gran parte resultó dañada por un incendio.En las diferentes naves que conforman los mercados del barrio que lleva el mismo nombre, los compradores pueden encontrar todo tipo de frutas, legumbres, carnes, semillas y frutos secos. Desde antes de ser nombrado formalmente como mercado de La Merced, diversos vendedores ya ofrecían sus productos en lo que antes era la zona perteneciente al convento que llevaba el mismo nombre. En 1957 el conjunto de mercados ubicados en el corazón de la Ciudad de México fue establecido oficialmente, y durante algunos años, hasta antes de la inauguración de la Centra de Abasto, monopolizó el comercio al menudeo y al mayoreo. Pero aunque la llegada de la Ceda transformó la dinámica de venta en esta zona, lo que no cambió fue su condición de seguir siendo el mercado minorista más grande de la capital.La pepenaUno de los fenómenos sociales infaltables en todo gran mercado es la pepena, y La Merced no está exenta de esta actividad. Desde sus inicios y hasta hoy en día es común ver personas buscando comida u objetos en buen estado entre lo que para otros fue considerado basura. Otra de las grandes famas del barrio de La Merced es su condición de zona roja de la capital, donde la prostitución se practica abiertamente. Caminar por las calles aledañas a los mercados ha sido históricamente desfilar frente las mujeres que ofrecen servicios sexuales a cambio de cierta cantidad. Los diferentes gobiernos han luchado para regular esta actividad que frecuentemente implica actividades ilegales como la trata de blancas o la explotación infantil. Este mercado que mueve al día toneladas de producto y por el que transitan cientos de personas no ha estado exento a las tragedias y los incendios han sido los que han marcado su existencia. El primer gran incendio que se tiene registrado fue en 1988 y fue ocasionado por la explosión en un local de venta de fuegos artificiales. El siniestro dejó un saldo de al menos 60 muertos. A partir del fatídico incendio el gobierno endureció los operativos para decomisar pirotecnia en el mercado, particularmente alrededor de las fechas en las que se populariza la venta de cohete como las fiestas patrias o decembrinas.El 4 de mayo de 1998 otro incendio afectó La Merced, según las investigaciones el fuego se originó en un corto circuito dentro de un local de chiles secos y piñatas. Las llamas destruyeron dos tercera partes de la nave principal del mercado, equivalente a casi 600 locales. Este accidente no dejó víctimas ni lesionados. El más reciente incendio en La Merced fue el del 27 de febrero de 2013, cuando el fuego consumió la mitad de la nave principal. Las llamas se originaron durante la madrugada, evitando que hubiera víctimas mortales. El origen, según se reportó en su momento fue un corto circuito en cables en mal estado.  El origen, según se reportó en su momento fue un corto circuito en cables en mal estado.El último incendio se registró este 24 de diciembre de 2019, en vísperas de Nochebuena, el cual afectó la nave principal del mercado y afectó al menos 630 locales. Además, dos personas murieron debido a una descarga eléctrica.Esta Navidad, la jefa de Gobierno, Claudia Sheinbaum, recorrió la zona del mercado y acordó con los locatarios afectados la rehabilitación completa del mismo, entre otros acuerdos.​La fiestaPero pese a los malos momentos, en el Mercado de La Merced lo que abunda es el ambiente clásico de un mercado popular, lleno de música y algarabía, la cual alcanza su máxima expresión el día del aniversario.En el mercado, sin duda se venera a la Virgen de La Merced, cuyo santo es el 24 de septiembre, así que los locatarios organizan alrededor de esa fecha una gran pachanga, como se dice popularmente, comienza religiosamente con una serenata a la patrona de los locatarios de los distintos mercados del barrio. La fiesta incluye baile, premios a los mejores pasos y en algunas ocasiones algunos conatos de bronca al calor de las bebidas. Entre jitomates, chiles secos y cebollas los locatarios le sacan lumbre al piso con sus mejores pasos, que reservan todo el año para esta fecha especial.Los alrededores del mercado, localizado en la manzana ubicada entre las calles San Ciprian, Rosario, Olvera y General Anaya, en el Barrio de La Merced, también han sido eje de la economía social, a través de decenas de comerciantes ambulantes que complementan la venta al interior del mercado o abastecen a los propios comerciantes con comida u otro tipo de artículos. Desde luego, las autoridades también han buscado desde hace muchos años y con éxito pasajero, ordenar este tipo de comercio y erradicarlo de la zona. "
https://www.milenio.com/politica/comunidad/metro-cdmx-50-anos-fotografias-extraordinarias,Metro CdMx: 50 años en fotografías extraordinarias,Olinka Valdez Morales,Ciudad de México,07-09-2019 22:45:00,"El proyecto emblemático de la Ciudad de México, el Metro, fue construido gracias a un crédito con el Banco Nacional de París por 1, 630 millones de pesos a 15 años, para 41.43 kilómetros de vía, e incluyó una campaña de relaciones públicas orientada a preparar a la ciudad frente a los posibles trastornos a consecuencia de la realización de los trabajos que, se estimó, durarían dos años. El gobierno federal, encabezado por Gustavo Díaz Ordaz, y el Departamento del Distrito Federal pusieron especial énfasis en destacar los beneficios del sistema por encima de los trastornos de la construcción original. Para arrancar el proyecto el gobierno expropió 34 predios para la construcción de las obras de las líneas 1, 2 y 3 del tren rápido subterráneo y se pagaron con cargo al patrimonio del organismo descentralizado del Sistema de Transporte Colectivo, constituido el 4 de enero de 1968. Los trabajos, distribuidos a lo largo de la Calzada de San Antonio Abad, de la Calzada de Tlalpan, en la calle de Tacuba y en la Avenida Chapultepec, fueron declarados de utilidad pública para construir estaciones, accesos y oficinas. De acuerdo con La Gran Ciudad, una memoria de la administración de Díaz Ordaz, la construcción del Metro constituyó el acontecimiento de 1969 y el 4 de septiembre, la Ciudad de México se convirtió en la 39 capital del mundo en contar con un tren subterráneo para enfrentar el problema de transporte en la capital.El Comité Consultivo de Transporte acordó que el Gobierno del Distrito Federal absorbería el costo total de la obra civil. La tarifa inicial fue de un peso con 20 centavos  y de un peso cuando el usuario adquiría series de 10 boletos. Entonces circulaban diariamente 1 millón de automóviles en la Ciudad de México que congestionaban avenidas y vías rápidas y que hacían prácticamente imposible ingresar al primer cuadro de la ciudad. Inicialmente se trató de seis vagones cada uno que corrían a tiempos fijos de tres minutos con una velocidad media de 80 kilómetros por hora, guiados y controlados electrónicamente desde el Puesto Central. Durante la construcción de las tres líneas se encontraron más de 2 mil piezas arqueológicas en los trabajaos de excavación, entre ellas el Adoratorio Circular del Dios del Viento Ehécatl, la diosa Xochiquetzal y una cabeza del Tláloc. Los trenes estaban formados por seis carros con capacidad para mil pasajeros; más tarde la composición de trenes sería de nueve carros con capacidad de mil 500 pasajeros. La velocidad máxima era de 80 kilómetros por hora. El recorrido de la línea 1, de un extremo a otro, era de 25 minutos; de la Línea 2, 29 minutos y de la Línea 3, 11 minutos. Línea 1Durante la construcción de la Línea1 corría de Chapultepec a Zaragoza. Posteriormente se acordó extender la línea hasta la Plaza Cartagena en Tacubaya.  La capacidad máxima de transporte era de 22 mil 500 pasajeros por hora en cada dirección y, junto con las otras dos líneas del proyecto, movilizó a 1 millón 800 mil personas diarias. La línea tenía 19 estaciones. La línea uno, que cruzaba la ciudad de Oriente a sur Poniente fue inaugurada por el presidente Díaz Ordaz, acompañado por Alfonso corona del Rosal, jefe del Departamento del Distrito Federal y el primer director del sistema de Transporte Colectivo, Leopoldo González Sáenz. Su construcción comenzó inmediatamente después de que terminaran la Línea 1 e inició en el trayecto de 2.4 kilómetros que separan la estación Bellas Artes de Pino Suárez. La línea tenía una longitud de 18.2 kilómetros e iba de Tacuba a Tasqueña. Originalmente contó con 21 estaciones, de las que 12 son subterráneas y nueve superficiales. Hoy tiene 24 estaciones. Comenzaba en la esquina de Obrero Mundial y Cuauhtémoc y terminaba al norte del monumento a La Raza, de Nocoalco a Narvarte.  La longitud era de 7.4 kilómetros y tenía nueve estaciones, hoy cuenta con 21. OVM​​​​​​​​"
https://www.milenio.com/politica/viajar-eu-vacunarse-sucede-turismo-vacunacion,¿Viajar a Estados Unidos para vacunarse contra covid-19? Estos son los riesgos,Milenio Digital,,28-01-2021 17:56:11,"En días pasados, trascendió que el conductor mexicano Juan José Origel viajó a Florida en calidad de turista para vacunarse contra covid-19, vacuna que un gran número de migrantes, personas sin hogar y adultos mayores no ha recibido.Pero no es el único que ha aprovechado la situación. Mauricio Fernández, tres veces alcalde de San Pedro Garza García, Nuevo León, recibió la vacuna  en Fresno, California. Texas, California y Florida son los destinos preferidos para hacer turismo de vacunas.La campaña de vacunación de Estados Unidos no pide pruebas de nacionalidad ni residencia, pues está pensada para llegar a las personas que no cuentan con papeles, como los migrantes indocumentados o las personas sin hogar. En algunas ciudades, las citas para recibir la vacuna anticovid son tan escasas que dejan a parte de la población sin acceso a ella. En Los Ángeles por ejemplo, hay personas que han tenido que hacer fila durante horas para conseguir una dosis sobrante de la vacuna.Además se ha reportado que los sistemas para agendar citas son ineficientes, dejando sin vacunas a poblaciones vulnerables. El 21 de enero, el Departamento de Salud de Florida anunció que la vacunación priorizará a los residentes del estado. Con esto se comenzarán a pedir pruebas que acrediten que una persona vive ahí. El documento dice que todo proveedor de vacunas en Florida debe asegurarse de que la persona sea residente del estado, capaz de demostrar su residencia. Ahora Florida solicita identificaciones oficiales, escrituras de la casa, hipotecas, estados de cuenta o contratos de alquiler, entre otros, para probar la residencia y recibir la vacuna anticovid. De extenderse las medidas para probar la residencia, las personas sin hogar no lograrían demostrar que son elegibles para la vacuna. Las personas migrantes que no cuentan con documentos también podrían tener dificultades a la hora de demostrar que viven en Estados Unidos.Personas discapacitadas, adultos mayores o en condiciones de pobreza que no cuentan con acceso a Internet o ayuda de familiares para agendar una cita, también estarían en riesgo.En redes sociales se ha pedido a las personas de altos ingresos sensibilizarse con los menos privilegiados, aun si eso implica tener que esperar la vacuna en México.Medios estadounidenses han dado a conocer la noticia del presentador mexicano que presumió al mundo su vacuna anticovid. ""Un popular presentador de televisión mexicano está bajo el fuego después de viajar a Florida sólo para recibir la codiciada vacuna covid-19 que la mayoría de los estadounidenses no han recibido"", publicó Fox News.Las nuevas políticas para recibir la vacuna en Florida indican que se dará prioridad a sus residentes de largo plazo, según el anuncio realizado por autoridades de salud del estado. El Departamento de Salud de Florida dejó claro que investigará cualquier uso indebido de la vacuna anticovid.Jason Mahon, vocero del Departamento de Salud, dijo: “Está absolutamente prohibido que alguien entre a Florida durante un día para recibir la vacuna y se vaya al día siguiente. Pedimos que todos los incidentes sospechosos se informen al departamento de salud de inmediato”.evr"
https://www.milenio.com/politica/quien-es-y-cuanto-gana-esteban-moctezuma-como-titular-de-la-sep,"¿Quién es Esteban Moctezuma, próximo embajador de México en EU?",Milenio Digital,Ciudad de México,16-12-2020 08:37:01,"Esteban Moctezuma Barragán, actual secretario de Educación Pública, será el próximo embajador de México en Estados Unidos, luego de que el presidente Andrés Manuel López Obrador lo propuso para el cargo, en sustitución de Martha Bárcena.Sin embargo, su carrera política comenzó en el sexenio de Ernesto Zedillo y tiene estudios en más de dos países. Para que lo conozcas mejor, aquí te decimos lo que debes saber sobre el próximo embajador.El secretario de Educación Pública nació el 21 de octubre de 1957 en la Ciudad de México. Es licenciado en Economía, con la cédula profesional 0531192, y tiene estudios en Derecho por la Universidad Nacional Autónoma de México, pero viajó a Inglaterra para cursar una maestría en Economía Política en la Universidad de Cambridge, en Inglaterra. Ante el registro de servidores púbicos, el secretario aclaró que, respecto a su formación en Derecho, aún debe presentar ""unas materias faltantes para concluir"". Además, cuenta con un diplomado sobre Desarrollo Regional en Tokio, Japón.Destaca su nombramiento como Doctor Honoris Causa, en 2012, de la Universidad de Ciencias y Artes de Chiapas.Su carrera política comenzó como titular de la Secretaría de Desarrollo Social y como secretario de Gobierno durante la administración de Ernesto Zedillo. También, se desempeñó como senador durante la LVII Legislatura, de 1997 a 1998. En 2002 comenzó a formar parte de Grupo Salinas y fue nombrado presidente de Fundación Azteca, sin embargo, en julio de 2018 renunció al cargo —después de 16 años al frente— para estar al frente de la SEP durante el gobierno de López Obrador. Estuvo en las filas del PRI de 1977 a 2002.​Iniciativas Ha sido impulsor de iniciativas legales para la adopción plena de menores, la creación del Servicio Civil de Carrera y la lay que prohíbe la promoción de la imagen de funcionarios con el empleo de recursos públicos. Durante el sexenio de Carlos Salinas de Gortari como presidente de México, Moctezuma Barragán se encargó del proceso para llevar a cabo la descentralización educativa, en 1992. Dos años más tarde fue responsable de instrumentar la autonomía de la Suprema Corte de Justicia de la Nación. En 1995, fue enviado para negociar la paz digna y justa con el subcomandante Marcos en el Campamento Zapatista de Guadalupe de Tepeyac. Esteban Moctezuma avaló el uso de un uniforme neutro en las escuelas públicas de educación básica de la Ciudad de México que permite a las niñas ir a clases con pantalón. La creación de un libro de texto gratuito de Geografía fue otro de sus proyectos, para el cual aseguró que “se reformó el libro de geografía que es de pasta dura, tiene una duración de tres años para que el niño lo pase a la generación que viene; con aplicaciones digitales y costó dos veces más”. En mayo de este año, la Cámara de Diputados aprobó la nueva Reforma Educativa que, entre otras cosas, desaparece las sanciones a los maestros que no aprueben las evaluaciones docentes. Durante un discurso, al inicio de su gestión como titular de la SEP, manifestó su rechazo a la Reforma Educativa que se tenía desde 2013 y anunció que ""se va a cancelar"" para iniciar ""una nueva era del magisterio en México"". Y este año, se enfrentó al reto de mantener las clases ante la pandemia de coronavirus. Uno de las medidas iniciales para prevenir contagios en escuelas, fue el adelanto de las vacaciones de Semana Santa.Posteriormente, se mantuvieron las clases a distancia, modalidad que continúa vigente, además de la implementación del programa Aprende en Casa para estudiantes de escuelas públicas, desde preescolar hasta preparatoria.Moctezuma Barragán tenía un sueldo mensual bruto de 154 mil 365.12 pesos como titular de la Secretaría de Educación Pública (SEP). Dicho salario se convierte en 107 mil 283.76 pesos mensuales netos luego del cálculo de impuestos y otras deducciones, de acuerdo con el portal Nómina Transparente. El funcionario gana mil 21 pesos menos que el presidente Andrés Manuel López Obrador, quien percibe 108 mil 305.51 pesos como sueldo mensual neto.ICC "
https://www.milenio.com/politica/comunidad/panteones-muertos-anos-fototeca-milenio,"Antes marimba, ahora mariachi: panteones en Día de Muertos a través de los años",Milenio Digital,Ciudad de México,02-11-2019 14:01:00,"Cada 1 y 2 de noviembre millones de mexicanos celebran el Día de Muertos para recordar a sus seres queridos con ofrendas cargadas de flores de cempasuchil, comida y música en los panteones. Durante varias horas, familias completas se reúnen en las tumbas para festejar esta tradición que, de acuerdo con la cosmovisión prehispánica, celebra el retorno transitorio de las ánimas o almas de los difuntos que regresan para convivir. A través de los años, la tradición ha cambiado para acoplarse a cada época, por ejemplo la música, pues antes se amenizaba la convivencia con marimba, mientras que ahora se llevan mariachis a los panteones. Durante varios años, se acostumbraba a vender comida adentro de los panteones o a rezar en el interior de las capillas, además éstas eran resguardados por policías a caballo. Actualmente, a los panteones también asisten algunas personas disfrazadas y otras aprovechan la fecha para limpiar, reparar y decorar para el resto del año las tumbas. icc​​​"
