url,title,author,location,date_time,article_text
https://www.milenio.com/politica/que-son-los-diputados-y-senadores-plurinominales-y-como-se-eligen,¿Qué son y cómo se eligen a los diputados y senadores plurinominales? Aquí te contamos,Milenio Digital,Ciudad de México,02-03-2021 07:18:21,"El Congreso de la Unión está integrado por 628 legisladores, de los cuales son 500 diputados y 128 senadores. A pesar de que la mayoría es elegida de manera democrática, hay un grupo que genera una amplia controversia por su forma de llegar a ocupar un papel en las decisiones del país: los plurinominales. A veces, sin necesidad de tener experiencia o una trayectoria política que los respalde, estos legisladores llegan a ocupar un escaño o un curul, cobrando más de un millón de pesos al año por su labor para debatir y aprobar leyes. Además, tampoco tienen la necesidad de realizar campaña ni competir contra otros candidatos para ganarse su puesto en el Palacio de San Lázaro o en el Senado. En esta jornada electoral, nombres como los de los ex candidatos presidenciales Margarita Zavala o Gabriel Quadri, así como el del dirigente nacional del PRI, Alejandro Moreno, han salido a la luz en los primeros lugares de las listas para integrarse al Congreso por la vía de representación proporcional, pero ¿qué son y cómo surgieron los plurinominales? Aquí te contamos.Para iniciar, es importante destacar que hay tres formas de integrarse a la asamblea legislativa: por mayoría relativa (aquellos que son votados y ganan durante las elecciones), por primera minoría (los que quedaron en segundo lugar de los comicios; aunque esta forma sólo es aplicada en el Senado), y de representación proporcional (también conocidos como plurinominales).Los plurinominales son elegidos por las dirigencias de los respectivos partidos a los que pertenecen y no necesitaron hacer campaña, aparecer en boletas electorales ni promover el voto ciudadano para ser parte de alguna de las cámaras. En la actualidad, el Congreso está conformado de la siguiente manera:Cámara de Diputados:Cámara de Senadores:Una vez integrados en el Congreso, los senadores y diputados plurinominales tienen el mismo propósito que aquellos elegidos: analizar y evaluar las iniciativas, decretos y leyes que se expedirán. Asimismo, su voto es igual de valido que el de quienes llegaron por la vía democrática. Así que, ante todas las luces, son diputados y senadores que ejercerán su cargo por periodos de tres y seis años, repectivamente.Si la elección de diputados y senadores se dejara únicamente a la decisión democrática, podría provocar que el Congreso de la Unión estuviese compuesto únicamente por legisladores de un solo partido. Esto ocurría con el PRI, cuando la mayoría o 100 por ciento de alcaldías, curules, escaños y hasta el presidente de la República eran del mismo partido, eliminando la resistencia a las reformas y la imposición de nuevas leyes. Con el fin de dar una representación democrática a los partidos minoritarios se implementó una reforma en 1977 por el entonces secretario de Gobernación (Segob), Jesús Reyes Heroles, quien, bajo la administración del presidente José López Portillo, propuso una iniciativa para dar mayor representatividad a todos los grupos en la Cámara de Diputados. La reforma también fue aplicada en el Senado en 1966.Este principio funciona para promover el debate, cuestionar e incluso detener la generación o eliminación de algunas leyes, evitando que se aprueben dictámenes que puedan dañar a la ciudadanía. Los legisladores plurinominales pueden ayudar a generar contrapesos en el sistema legislativo, garantizando un sistema democrático en el país.Todos los partidos políticos deberán elaborar una lista de sus candidatos para integrarse al Congreso por la vía plurinominal. Los listados deberán hacerse públicas y a cada candidato se le dará un número, el cual, entre más pequeño sea, tendrá más oportunidades de convertirse en diputado o senador.Las dirigencias nacionales de cada movimiento son las encargadas de determinar, bajo sus propios criterios, a los personajes que las integrarán y el número en que estos se encontrarán. Por su parte, el Instituto Nacional Electoral (INE) será el responsable de decidir, bajo el principio de representación proporcional, cuántos diputados o senadores le corresponde a cada partido.De acuerdo con el número de votos que por partido partidos y circunscripción electoral será la cantidad de legisladores de representación proporcional que puedan integrar. Este número coincidirá a su vez con las listas de los partidos, por ejemplo, si el INE otorga 50 diputaciones al partido “A”, los primeros 50 números de su lista tendrán un lugar como legisladores en el Palacio de San Lázaro.Aquellos candidatos plurinominales que ocupen los primeros lugares de las listas tienen prácticamente garantizado su lugar dentro del Congreso de la Unión. Para que este principio continúe garantizando la democracia, ningún partido podrá tener más de 300 diputados por ambos principios y se ha propuesto que, todos los legisladores de representación proporcional sólo puedan reelegirse una vez.Y tú, ¿qué opinas de los legisladores plurinominales?​LP"
https://www.milenio.com/politica/iniciativas-de-amlo-pendientes-en-el-congreso,¿Cuáles son las iniciativas de AMLO pendientes en el Congreso para este 2021?,Milenio Digital,Ciudad de México,19-01-2021 07:21:24,"El 1 de febrero comienza el segundo periodo de sesiones del Congreso, es decir, tanto la Cámara de Diputados y el Senado reinician sesiones, luego de los trabajos de los legisladores en la Comisión Permanente, pero ¿Cuáles son las iniciativas pendientes de discutir propuestas por el presidente Andrés Manuel López Obrador?Con la Ley Federal del Trabajo se busca limitar el llamado outsourcing, una iniciativa prioritaria del presidente López Obrador y aunque ya había iniciado su discusión, se pospuso para febrero de este año debido a algunas inconformidades por parte de los empresarios. Sin embargo, el mandatario firmó un acuerdo con la Iniciativa Privada y el sector obrero que contempla mejorar las condiciones laborales, el cual contempla cuatro puntos, de acuerdo con la Secretaría del Trabajo y Previsión Social (STyPS). Uno de los pendientes en la Cámara de Diputados se trata de los cambios a la Ley Federal del Trabajo que busca que el aumento del salario mínimo se realice por encima de la inflación, un tema que ha sido puesto sobre la mesa desde el inicio de la administración del mandatario.Mientras que en el Senado, los legisladores deberán revisar la Ley Federal de Remuneraciones de los Servidores Públicos con la que se ordena que ningún funcionario gane más que el Presidente de la República. La iniciativa se mantiene pendiente desde septiembre; sin embargo, los senadores deberán resolverla antes del 30 de abril como mandato de la Suprema Corte de Justicia de la Nación (SCJN). La iniciativa establece que el sueldo del jefe del Ejecutivo sería de mínimo 131 mil 315 pesos y un máximo de 143 mil 055 pesos mensuales. También, regula los salarios de acuerdo con la jerarquía en la función pública que desempeña y establece que los servidores públicos recibirán una remuneración adecuada e irrenunciable por el desempeño de su función, empleo, cargo o comisión que deberá ser proporcional a sus responsabilidades y que las remuneraciones que sean superiores a las del mandatario deberán ser ajustadas o disminuidas en los presupuestos de egresos correspondientes.En diciembre, el Pleno del Senado aprobó por unanimidad, en lo general y lo particular, el dictamen que expide la Ley General de Educación Superior y abroga la Ley para la Coordinación de la Educación Superior, con la cual se dispone la obligatoriedad de la educación superior y reitera la gratuidad de las universidades públicas, por lo que la minuta deberá ser discutida y aprobada por la Cámara de Diputados. Entre los cambios se contempla una multa de 2 millones 606 mil 400 pesos y hasta la clausura del plantel para los centros educativos denominados como técnico superior universitario, profesional asociado, licenciatura, especialidad, maestría o doctorado que no cuenten con el reconocimiento de validez oficial de estudios o su admisión a trámite u ostentarlos sin haberlos recibido. Otras de las reformas pendientes son la ley orgánica de la Fiscalía General de la República (FGR), la Ley del Banco de México, la Ley General de Ciencia, Tecnología e Innovación, y la Ley Federal para la Regulación del Cannabis. Además de la ratificación del actual secretario de Educación Pública (SEP), Esteban Moctezuma, como embajador de México en Estados Unidos. icc​"
https://www.milenio.com/politica/camara-de-diputados-y-senadores-que-es-y-cual-es-su-funcion-en-mexico,¿Qué hacen la Cámara de Diputados y el Senado?,Milenio Digital,Ciudad de México,02-02-2021 10:36:41,"El 1 de febrero dio inicio el segundo periodo de sesiones de la Cámara de Diputados y el Senado, en donde se quedaron varias iniciativas pendientes en diciembre ante el receso; ¿cuál es la función de estos dos órganos legislativos? Te explicamos. La cámara baja integrada por 500 diputados electos para ocupar un curul durante tres años. Está conformada por:Las funciones de la Cámara de Diputados son la aprobación anual del Presupuesto de Egresos de la Federación (PEF) y revisar la cuenta pública del año anterior. También tiene la asignación de aprobar o rechazar si se procede penalmente contra algún funcionario, así como el nombramiento de consejeros electorales. Se compone de órganos legislativos con el Pleno a la cabeza, acompañado de los grupos parlamentarios representados por partidos políticos. Además de comisiones conformadas por una mesa directiva y una Junta de Coordinación Política (Jucopo). Para que el Pleno pueda ejercer necesita la presencia de más de la mitad de los diputados. La Mesa Directiva es la que se encarga de conducir las sesiones y el trabajo del Pleno. Y la Jucopo se integra por los coordinadores de cada uno de los grupos parlamentarios. ¿Qué hace el Senado? Es la cámara alta integrada por 128 legisladores que ocupan un escaño durante seis años. Actualmente se encuentra en Paseo de la Reforma, pero por muchos años su sede fue la histórica Antigua Casona de Xicoténcatl. Está conformado por:El Senado tiene las facultades exclusivas de analizar la política exterior del Presidente y aprobar los tratados internacionales como el T-MEC, por ejemplo. Además, funcionar como jurado de sentencia en los juicios políticos, por falta u omisiones de servidores públicos, así como la ratificación o designación del titular de la Fiscalía General de la República (FGR), de la Comisión Nacional de Derechos Humanos (CNDH) y a ministros de la Suprema Corte de Justicia (SCJN). También, los senadores tienen la facultad de autorizar los movimientos de la fuerzas armadas, ya sea en territorio nacional o internacional. icc"
https://www.milenio.com/politica/izquierda-derecha-politica-origen-terminos-significado,¿Qué significa ser de izquierda o derecha en el ámbito político?,Milenio Digital,Ciudad de México,16-02-2021 06:55:45,"En cualquier sociedad que se diga democrática es necesario la existencia de pluralidad de opiniones, posturas políticas, muchas de ellas pueden chocar en su totalidad o compartir algunas características; dos de las más conocidas, y muy debatidas, son la izquierda y la derecha. Es importante partir del origen de izquierda y derecha. La historia asegura que nacieron con la Revolución Francesa. Luis Eduardo González Ferrer y Rosario Queirolo Velasco recuerdan en su ensayo Izquierda y derecha: formas de definirlas, el caso latinoamericano y sus implicaciones, cómo surgió el término:Hay que aclarar algo, las definiciones cambian a lo largo del tiempo y no necesariamente significan lo mismo en todos los países, incluso, si en México algo es considerado de ‘izquierda’, en otros países puede ser visto como de ‘derecha’, o viceversa, por eso no hay una definición concreta y no es generalizada.“Muchas de las posiciones políticas que ahora consideramos de derecha fueron de izquierda en otro momento. El ejemplo clásico para Europa, al que han recurrido muchos autores, incluido Marx, fue el liberalismo y la lucha de la burguesía contra el absolutismo y los obstáculos del antiguo régimen que impedían su desenvolvimiento. La burguesía fue, en un momento dado, una clase revolucionaria. Luego fue conservadora. El liberalismo, como ideología de un sector de la naciente burguesía europea, fue también considerado progresista, de izquierda”, expone el investigador de la UNAM Octavio Rodríguez Araujo en su ensayo Derechas.Depende a quien se pregunte; politólogos, filósofos, historiadores y la ciudadanía tiene su propia definición, pero si hay que elegir una, el investigador italiano Giovanni Sartori, tiene un concepto plasmado en su libro “La democracia en 30 lecciones”. En entrevista con Leo Zuckemann para Foro TV, Rafael Correa, ex presidente de Ecuador, tiene una definición sobre qué es ser de izquierda: “buscar la justicia en todas la dimensiones, no solo la justicia social, la justicia de género, la justicia étnica (...)”.Octavio Rodríguez Araujo añade en su mismo ensayo que ""ha sido asociado a la conservación del statu quo. Es un calificativo reservado comúnmente a los conservadores, a los defensores del orden establecido"". La investigadora de El Colegio de México, Soledad Loeaza, explica en un artículo de Nexos que en el contexto de la Revolución Francesa: “la derecha defendía los derechos de la monarquía y el orden jerárquico y corporativizado del Antiguo Régimen”. Si recordamos la premisa de que ningún concepto se mantiene, Rodríguez Araujo podría añadir que: “Antes de los años 60 del siglo pasado, y por mucho tiempo, la derecha estuvo identificada, más en el discurso que en la realidad, con la defensa de la pluralidad y con un cierto eclecticismo; ahora es al revés, es la izquierda la que defiende la pluralidad y se opone al pensamiento único, y más todavía a la imposición de un pensamiento único y a una visión unilateral del mundo”. Parafraseando a Rodríguez Araujo, en lo general se tiene relacionada a la izquierda con ser progresista y a la derecha con el conservadurismo. La historia nos ha enseñado que ningún pensamiento o postura política es perfecta, pero es importante tenerla porque de ello se nutre el debate y por ende, la democracia. JLMR"
https://www.milenio.com/politica/cuanto-gana-el-presidente-de-la-cndh,¿Cuánto gana el presidente de la CNDH?,Milenio Digital,Ciudad de México,28-10-2019 15:38:20,"La Comisión Nacional de Derechos Humanos (CNDH) tendrá cambio de presidente en noviembre, por lo que el Senado comenzó hace una semana las comparecencias de los aspirantes a encabezar esta instituciónEl relevo de Luis Raúl González Pérez ocupará el cargo del 16 de noviembre de este año al 15 del mismo mes en 2024. Aquí te contamos cuánto ganará el nuevo presidente de la comisión.El titular de la CNDH recibirá un sueldo bruto mensual de 154 mil 066 pesos, cantidad que se divide en sueldo base de 29 mil 052 pesos y compensación garantizada de 125 mil 014 pesos. De acuerdo con el tabulador mensual de sueldos del Manual de Percepciones de las y los Servidores Públicos de la CNDH para el año 2019, algunas de las prestaciones son aguinaldo, seguro de vida institucional y ayuda para despensa. Luego de la auscultación, los senadores deberán realizar propuestas para enviarlas al Ejecutivo, representado por Andrés Manuel López Obrador, quien mandará una terna al pleno a más tardar el 31 de octubre. Algunos de los postulantes están María del Rosario Piedra Ibarra, hija Rosario Ibarra; Ricardo Bucio, secretario ejecutivo del Sistema Nacional de Protección Integral para Niñas y Niños y William Chamberlain, consejero de la CNDH. En la lista también figura Elizabeth Lara Rodríguez, a quien públicamente ha respaldado el padre Alejandro Solalinde para suceder a González Pérez. icc"
https://www.milenio.com/politica/martha-tagle-mi-militancia-y-el-feminismo-perfil,"Mi militancia, el feminismo y la batalla contra el machismo: Martha Tagle",José Luis Medina,Ciudad de México,18-01-2021 06:53:05,"Martha Tagle pudo ser periodista; en la preparatoria usaba el periódico mural de su escuela para plasmar entrevistas a políticos poblanos de la época e incluso, participó en un programa de radio, pero ese derrotero no siguió y hoy si se busca en Google el nombre de la diputada federal por Movimiento Ciudadano aparecerán las palabras: feminismo, igualdad y derechos de las mujeres, sólo por mencionar algunas.La legisladora es recordada, entre muchas cosas, por cuestionar a Rosario Robles en su última comparecencia como titular de la Secretaría de Desarrollo Agrario, Territorial y Urbano (Sedatu), pero la valentía que le ayudó a decirle a la ex jefa de Gobierno que formaba parte de una red de corrupción que encabeza Enrique Peña Nieto, pero de la cual ""parece ser usted el eslabón más débil” no fue gratis; de niña era introvertida, pero en la adolescencia se preparó con talleres de teatro y oratoria para expresarse mejor.   Tagle empezó a conocer las ciencias políticas cuando estudió la carrera en Tlaxcala, mientras salía el resultado para estudiar en la UNAM. Otro de sus primeros acercamientos con la política lo tuvo cuando trabajó como secretaria taquimecanógrafa en las oficinas de un partido, y tras adentrarse en ese mundo, hizo su cambio de carrera a Ciencias Políticas en Ciudad Universitaria.A la legisladora le tocó presenciar desde la trinchera administrativa de la UNAM la huelga de 1999, en la que los estudiantes se oponían a la modificación del Reglamento General de Pagos, que empujó la renuncia del rector Francisco Barnés de Castro, siendo sustituido por Juan Ramón de la Fuente.   En la Facultad de Ciencias Políticas y Sociales, Tagle fue secretaria técnica, profesora adjunta y antes de la huelga participó en la reforma de los planes de estudio. ​El conocimiento de Tagle sobre el feminismo quizá se dio de facto desde su infancia, pero tras adentrarse en la política le tocó organizar un encuentro de mujeres jóvenes y gracias a la Ley Robles empezó a adentrarse en la causa feminista.Ella lo tiene claro, la militancia de Martha Tagle es en el feminismo, pues se le relaciona más con esa lucha que con el partido político con el que tiene un vínculo.  Las resistencias contra el machismo son diarias, pero reconoce que muchas de ellas se han ido venciendo y pone de ejemplo el aumento de la participación política de las mujeres a partir del 2021. Tagle hace un llamado a otras mujeres a no sentirse solas ni desistir, además de derribar mitos de que no pueden trabajar en equipo, pues están unas con otras. JLMR"
https://www.milenio.com/politica/karla-quintana-comision-nacional-busqueda-desapariciones-forzadas,Karla Quintana y su tarea para encontrar a los desaparecidos en México,José Luis Medina,Ciudad de México,01-02-2021 07:01:31,"De 2006 a la fecha, han desaparecido 83 mil 001 personas en México, y el trabajo de Karla Quintana en la Comisión Nacional de Búsqueda es coordinar los esfuerzos para encontrarlas. Su labor en defensa de los derechos humanos es una decisión de vida, cómo ella lo dice. La Universidad Nacional Autónoma de México ha estado con ella en su derrotero. Estudió dos licenciaturas: Derecho y Lengua y Literatura Hispánicas, aunado a un doctorado en el Instituto de Investigaciones Jurídicas de la UNAM; actualmente imparte clases en la Facultad de Derecho. Como universitaria, le tocó vivir la huelga de 1999 y marchó en Ciudad Universitaria, asistió a las asambleas, pero no fue parte del movimiento fuerte. “En la Universidad Nacional nos inculcan el estudiar y dedicar la vida a servir”.Quintana confiesa que en sus boletas de calificaciones los dieces destacaban aunque aclara, “no era matada”, pero para poder jugar basquetbol tenía que terminar antes sus tareas. Además del básquetbol, también sabe tocar la jarana, guitarra y acordeón y Cucurrucucú es su melodía favorita para interpretar. Una temporada vivió en Costa Rica y ahí sus amigos le entrenaron para bailar.La enseñanza familiar de preocuparse por el otro ha permitido a Karla Quintana no perder la capacidad de indignación ante las injusticias que enfrenta durante su labor: “es algo que uno tiene que estar alimentando: estar en terreno, estar en los hechos, las violaciones y ver cómo la formación profesional es siempre pensando cómo lo que estoy aprendiendo va a servir para incidir en tratar de hacer un cambio”.     La Ley General en Materia de Desaparición Forzada de Personas, Desaparición Cometida por Particulares y del Sistema Nacional de Búsqueda de Personas define a los desaparecidos como: ""persona cuyo paradero se desconoce y se presume, a partir de cualquier indicio, que su ausencia se relaciona con la comisión de un delito"", pero Quintana asegura que explicar este fenómeno en términos humanos es difícil.Quintana apela a la humanidad para que la sociedad no sea indiferente a las desapariciones: ""saber y entender que lo que le pasa al otro nos afecta como colectivo”. Quintana expuso que se han tenido avances importantes en la búsqueda de personas; pone como ejemplo el Registro Nacional de Personas Desaparecidas, pero aún faltan otras acciones. “Uno de los grandes faltantes en México es hacer estudios contextuales: Las desapariciones no son aisladas, si no se ven dentro de un contexto, muy difícilmente se les podrá buscar y hacer justicia”. En términos de justicia, Quintana reconoce que el camino es largo, pues al 8 de enero sólo hay 35 sentencias en materia de desaparición forzada en el país “y tenemos decenas de miles de averiguaciones abiertas por la desaparición de personas y tenemos decenas de miles de cuerpos sin identificar”.   JLMR"
https://www.milenio.com/politica/maria-celeste-sanchez-senadora-mujer-afromexicana,"María Celeste Sánchez Sugia, la senadora afromexicana que estudia sanguijuelas",Itzaxaya Campos,Ciudad de México,01-03-2021 06:55:44,"Estudiar sanguijuelas, hacer bordados feministas y presentar propuestas de ley en el Senado es parte del día a día de María Celeste Sánchez Sugia, la primera senadora afromexicana que combina su trabajo político con la ciencia.Con 31 años, se convirtió en senadora suplente de Citlalli Hernández, quien dejó el cargo para desempeñarse como secretaria general de Morena. Sin embargo, María Celeste comenzó su carrera política siete años atrás, al involucrarse con asociaciones civiles ligadas con temas de afrodescendientes y migrantes. Es psicóloga por la UNAM y candidata a doctora en Ciencias Biomédicas, en donde estudia en el área de las neurociencias tanto con ratones como con sanguijuelas.María Celeste inició en el activismo afromexicano luego de identificarse como descendiente africana a través de lo que escuchaba de voz de expertos y académicos: ""Yo toda mi infancia y adolescencia la viví sin saber que era afromexicana, sin identificarme y sintiendo mi identidad incompleta. Todo esto te lleva a vivir discriminación y racismo. ¿Cómo te defiendes ante eso? Estando orgullosa de tu historia"". Nació en Ciudad de México y su mamá es originaria de Cuajinicuilapa, Guerrero, comunidad que destaca por tener el mayor número de afromexicanos, población que por primera vez se incluyó en el censo de 2020 del Instituto Nacional de Geografía y Estadística (Inegi) con un resultado de 2 millones 576 mil 213 personas que se reconocen como afrodescendientes, es decir, 2% de todos los habitantes de México. De ellos, 49.6% corresponde a hombres y 50.4% a mujeres.Los estados con mayor presencia de afrodescendientes son Guerrero, Oaxaca, Baja California Sur, Yucatán, Quintana Roo y Veracruz. Para María Celeste, un gran paso en México sería aceptar que se vive en un país ""racista, discriminatorio, y que nos respaldamos en que son chistes o que no pasa nada o que el mexicano es muy bromista; la deuda histórica que se tiene con la población afro es enorme"". ¿Cómo vive el afrofeminismo? Uno de los temas recurrentes con María Celeste es el feminismo, pero desde la trinchera de las raíces africanas, pues aseguró que la discriminación y racismo que viven las mujeres es distinta dependiendo sus orígenes. ""Bordar me salvó de la pandemia""Una de las pasiones de María Celeste es bordar, algo que ha le resultado un escape ante la pandemia de covid-19. En sus bordados incluye temáticas de feminismo, pero también considera que es parte de su identidad y lo ve como una forma de transmitir la historia. Retos y logros legislativosMaría Celeste recordó como un logro en México el hecho de que el 28 de junio de 2019 la población afromexicana se reconociera en la Constitución a partir de la reforma al Artículo 2 como parte de la composición pluricultural del país, ""que se haya dado un reconocimiento fue un gran logro no sólo para mí, sino para toda la población"". Su propósito en el Senado es entablar una vía de comunicación en la toma de decisiones entre las asociaciones civiles y los legisladores, ""es uno de mis grandes objetivos"". También, participa en la propuesta para que el nombre de la Comisión de Asuntos Indígenas se cambie a Comisión de Asuntos Indígenas y Afromexicanos. icc"
